element_id,skill_name,skill_description
2.A.1.a,"Reading Comprehension","Understanding written sentences and paragraphs in work-related documents."
2.A.1.b,"Active Listening","Giving full attention to what other people are saying, taking time to understand the points being made."
2.B.5.c,"Customer Relationship Management","Managing interactions to improve customer satisfaction and retention using CRM tools like Salesforce."
2.B.4.g,"Data Analysis","Collecting and analyzing data to identify trends and improve service processes."
2.C.3.a,"Complaint Resolution","Handling customer complaints effectively to reach satisfactory outcomes."
2.D.1.b,"Team Leadership","Leading and mentoring team members to achieve performance goals."
2.E.2.a,"Conflict Resolution","Managing and resolving conflicts in a professional manner."
2.F.1.a,"Multichannel Communication","Communicating effectively via phone, email, chat, and social media platforms."
